<?xml version="1.0" encoding="UTF-8" standalone="no" ?>

<!DOCTYPE actions SYSTEM "dtd/quetes.dtd">

<actions>
    <dialogue joueur="True">Bonjour ! Le chef m'a dit que vous
m'autoriseriez à passer.</dialogue>
    <dialogue joueur="False">Oui, en effet, sachez cependant que vous ne
pourrez pas revenir en arrière.</dialogue>
    <dialogue joueur="True">Oui, je sais, merci.</dialogue>
    <deplacement x="-1" y="0" joueur="False"/>
    <deplacement x="0" y="-1" joueur="True"/>
    <deplacement x="0" y="-1" joueur="True"/>
    <deplacement x="1" y="0" joueur="False"/>
</actions>